{
  "$id": "https://petstore.swagger.io/v2/pet.json",
  "$schema": "https://json-schema.org/draft/2020-12/schema",
  "type": "object",
  "required": ["name", "photoUrls"],
  "properties": {
    "id": {
      "type": "integer",
      "format": "int64"
    },
    "category": {
      "$ref": "#/Category"
    },
    "name": {
      "type": "string",
      "example": "doggie"
    },
    "photoUrls": {
      "type": "array",
      "xml": {
        "wrapped": true
      },
      "items": {
        "type": "string",
        "xml": {
          "name": "photoUrl"
        }
      }
    },
    "tags": {
      "type": "array",
      "xml": {
        "wrapped": true
      },
      "items": {
        "xml": {
          "name": "tag"
        },
        "$ref": "#/Tag"
      }
    },
    "status": {
      "type": "string",
      "description": "pet status in the store",
      "enum": ["available", "pending", "sold"]
    }
  },
  "xml": {
    "name": "Pet"
  },
  "Tag": {
    "type": "object",
    "properties": {
      "id": {
        "type": "integer",
        "format": "int64"
      },
      "name": {
        "type": "string"
      }
    },
    "xml": {
      "name": "Tag"
    }
  },
  "Category": {
    "type": "object",
    "properties": {
      "id": {
        "type": "integer",
        "format": "int64"
      },
      "name": {
        "type": "string"
      }
    },
    "xml": {
      "name": "Category"
    }
  }
}